{
  "$schema": "https://json-schema.org/draft/2020-12/schema",
  "$id": "dotgame/daily-reactions.schema.json",
  "title": "DotGame 일일 반응 대사 (data/daily_reactions.json) v1 — 스토리 봇 제안(story/daily_reaction.schema.json) 채택",
  "type": "object",
  "required": [
    "version",
    "updated_at",
    "is_sample",
    "date",
    "reactions"
  ],
  "properties": {
    "version": {
      "const": 1
    },
    "updated_at": {
      "type": "string",
      "pattern": "^\\d{4}-\\d{2}-\\d{2}T\\d{2}:\\d{2}(:\\d{2})?\\+09:00$"
    },
    "is_sample": {
      "type": "boolean"
    },
    "note": {
      "type": "string"
    },
    "date": {
      "type": "string",
      "pattern": "^\\d{4}-\\d{2}-\\d{2}$",
      "description": "이 반응이 쓰이는 날짜(KST). 오늘 날짜와 다르면 게임은 폴백 사용"
    },
    "news_updated_at": {
      "type": "string",
      "description": "참조한 data/news.json 의 updated_at. 다르면 news_ref 반응은 건너뜀"
    },
    "reactions": {
      "type": "array",
      "maxItems": 40,
      "items": {
        "$ref": "#/$defs/reaction"
      }
    },
    "fallback_lines": {
      "type": "object",
      "description": "선택. 캐릭터 id → 오늘 반응이 없을 때 쓸 대사(1줄씩). 없으면 게임 내장 폴백",
      "propertyNames": {
        "$ref": "#/$defs/character"
      },
      "additionalProperties": {
        "type": "array",
        "items": {
          "type": "string",
          "minLength": 1,
          "maxLength": 60
        }
      }
    }
  },
  "$defs": {
    "character": {
      "enum": [
        "juyeon",
        "hyunsu",
        "park_youngmi",
        "jung_hyuna",
        "jo_sunmi",
        "lee_jin",
        "kang_myeongheon"
      ]
    },
    "building": {
      "enum": [
        "pcbang",
        "cooking",
        "entertainment",
        "sports",
        "academy",
        "newscenter"
      ]
    },
    "stage": {
      "enum": [
        "s1_comfortable",
        "s2_study_mate",
        "s3_friend",
        "s4_close",
        "s5_flutter",
        "post_ending"
      ]
    },
    "period": {
      "enum": [
        "class",
        "self_study",
        "juyeon_away",
        "exam_sprint",
        "exam_day",
        "waiting",
        "post_ending"
      ]
    },
    "emotion": {
      "enum": [
        "neutral",
        "smile",
        "laugh",
        "excited",
        "curious",
        "surprised",
        "shy",
        "worried",
        "sad",
        "proud",
        "tired"
      ]
    },
    "line": {
      "type": "object",
      "required": [
        "speaker",
        "text"
      ],
      "properties": {
        "speaker": {
          "$ref": "#/$defs/character"
        },
        "text": {
          "type": "string",
          "minLength": 1,
          "maxLength": 60
        },
        "emotion": {
          "$ref": "#/$defs/emotion"
        }
      },
      "additionalProperties": false
    },
    "lines": {
      "type": "array",
      "minItems": 1,
      "maxItems": 2,
      "items": {
        "$ref": "#/$defs/line"
      }
    },
    "reaction": {
      "type": "object",
      "required": [
        "id",
        "character",
        "topic",
        "where",
        "trigger",
        "emotion",
        "lines"
      ],
      "properties": {
        "id": {
          "type": "string",
          "pattern": "^r\\d{8}_[a-z0-9_]+$"
        },
        "news_ref": {
          "type": [
            "object",
            "null"
          ],
          "required": [
            "building",
            "item_index",
            "title"
          ],
          "properties": {
            "building": {
              "enum": [
                "pcbang",
                "cooking",
                "entertainment",
                "sports",
                "newscenter"
              ]
            },
            "item_index": {
              "type": "integer",
              "minimum": 0,
              "maximum": 9
            },
            "title": {
              "type": "string",
              "maxLength": 60,
              "description": "news.json 해당 item 의 title 과 정확히 같아야 함(검증용)"
            },
            "category_id": {
              "type": "string",
              "description": "building=newscenter 일 때 필수(politics/economy/society/world). sports 가 종목별 categories 를 쓰면 mancity/doosan/f1/ufc"
            }
          },
          "additionalProperties": false,
          "if": {
            "properties": {
              "building": {
                "const": "newscenter"
              }
            }
          },
          "then": {
            "required": [
              "category_id"
            ]
          }
        },
        "topic": {
          "enum": [
            "game_general",
            "game_fc_online",
            "game_coop_story",
            "recipe",
            "coffee",
            "kpop_release",
            "kpop_performance",
            "kpop_event",
            "kbo_doosan",
            "kbo_kia",
            "kbo_general",
            "epl_mancity",
            "f1",
            "ufc",
            "sports_general",
            "study",
            "daily",
            "news_general"
          ]
        },
        "character": {
          "$ref": "#/$defs/character"
        },
        "where": {
          "oneOf": [
            {
              "$ref": "#/$defs/building"
            },
            {
              "const": "message"
            }
          ]
        },
        "trigger": {
          "enum": [
            "after_news",
            "on_talk",
            "message"
          ]
        },
        "conditions": {
          "type": "object",
          "properties": {
            "stages": {
              "type": "array",
              "items": {
                "$ref": "#/$defs/stage"
              }
            },
            "periods": {
              "type": "array",
              "items": {
                "$ref": "#/$defs/period"
              }
            },
            "requires_flags": {
              "type": "array",
              "items": {
                "type": "string"
              }
            },
            "excludes_flags": {
              "type": "array",
              "items": {
                "type": "string"
              }
            }
          },
          "additionalProperties": false
        },
        "emotion": {
          "$ref": "#/$defs/emotion"
        },
        "lines": {
          "$ref": "#/$defs/lines"
        },
        "variants": {
          "type": "object",
          "description": "선택. 단계 id → 그 단계에서 lines 대신 쓸 대사",
          "propertyNames": {
            "$ref": "#/$defs/stage"
          },
          "additionalProperties": {
            "$ref": "#/$defs/lines"
          }
        },
        "priority": {
          "type": "integer",
          "minimum": 0,
          "maximum": 9,
          "description": "같은 장소·트리거 후보가 여럿이면 큰 값 우선"
        }
      },
      "additionalProperties": false
    }
  }
}
